\set ECHO none
-- SRF function implementing a simple deterministict PRNG
CREATE OR REPLACE FUNCTION prng(nrows int, seed int = 23982, p1 bigint = 16807, p2 bigint = 0, n bigint = 2147483647) RETURNS SETOF double precision AS $$
DECLARE
    val INT := seed;
BEGIN
    FOR i IN 1..nrows LOOP
        val := (val * p1 + p2) % n;

        RETURN NEXT (val::double precision / n);
    END LOOP;

    RETURN;
END;
$$ LANGUAGE plpgsql;
CREATE OR REPLACE FUNCTION random_normal(nrows int, mean double precision = 0.5, stddev double precision = 0.1, minval double precision = 0.0, maxval double precision = 1.0, seed int = 23982, p1 bigint = 16807, p2 bigint = 0, n bigint = 2147483647) RETURNS SETOF double precision AS $$
DECLARE
    v BIGINT := seed;
    x DOUBLE PRECISION;
    y DOUBLE PRECISION;
    s DOUBLE PRECISION;
    r INT := nrows;
BEGIN

    WHILE true LOOP

        -- random x
        v := (v * p1 + p2) % n;
        x := 2 * v / n::double precision - 1.0;

        -- random y
        v := (v * p1 + p2) % n;
        y := 2 * v / n::double precision - 1.0;

        s := x^2 + y^2;

        IF s != 0.0 AND s < 1.0 THEN

            s = sqrt(-2 * ln(s) / s);

            x := mean + stddev * s * x;

            IF x >= minval AND x <= maxval THEN
                RETURN NEXT x;
                r := r - 1;
            END IF;

            EXIT WHEN r = 0;

            y := mean + stddev * s * y;

            IF y >= minval AND y <= maxval THEN
                RETURN NEXT y;
                r := r - 1;
            END IF;

            EXIT WHEN r = 0;

        END IF;

    END LOOP;

END;
$$ LANGUAGE plpgsql;
-----------------------------------------------------------
-- nice data set with ordered (asc) / evenly-spaced data --
-----------------------------------------------------------
-- 10 centroids (tiny)
WITH data AS (SELECT i / 1000000.0 AS x FROM generate_series(1,1000000) s(i))
SELECT
    p,
    abs(a - b) < 0.01, -- arbitrary threshold of 1%
    (CASE WHEN abs(a - b) < 0.01 THEN NULL ELSE (a - b) END) AS err
FROM (
    SELECT
        unnest(ARRAY[0.01, 0.05, 0.1, 0.9, 0.95, 0.99]) AS p,
        unnest(tdigest_percentile(x, 10, ARRAY[0.01, 0.05, 0.1, 0.9, 0.95, 0.99])) AS a,
        unnest(percentile_cont(ARRAY[0.01, 0.05, 0.1, 0.9, 0.95, 0.99]) WITHIN GROUP (ORDER BY x)) AS b
    FROM data
) foo;
  p   | ?column? | err 
------+----------+-----
 0.01 | t        |    
 0.05 | t        |    
  0.1 | t        |    
  0.9 | t        |    
 0.95 | t        |    
 0.99 | t        |    
(6 rows)

-- make sure the resulting percentiles are in the right order
WITH data AS (SELECT i / 1000000.0 AS x FROM generate_series(1,1000000) s(i)),
     perc AS (SELECT array_agg((i/100.0)::double precision) AS p FROM generate_series(1,99) s(i))
SELECT * FROM (
    SELECT
        p,
        a,
        LAG(a) OVER (ORDER BY p) AS b
    FROM (
        SELECT
            unnest((SELECT p FROM perc)) AS p,
            unnest(tdigest_percentile(x, 10, (SELECT p FROM perc))) AS a
        FROM data
    ) foo ) bar WHERE a <= b;
 p | a | b 
---+---+---
(0 rows)

-- 100 centroids (okay-ish)
WITH data AS (SELECT i / 1000000.0 AS x FROM generate_series(1,1000000) s(i))
SELECT
    p,
    abs(a - b) < 0.01, -- arbitrary threshold of 1%
    (CASE WHEN abs(a - b) < 0.01 THEN NULL ELSE (a - b) END) AS err
FROM (
    SELECT
        unnest(ARRAY[0.01, 0.05, 0.1, 0.9, 0.95, 0.99]) AS p,
        unnest(tdigest_percentile(x, 100, ARRAY[0.01, 0.05, 0.1, 0.9, 0.95, 0.99])) AS a,
        unnest(percentile_cont(ARRAY[0.01, 0.05, 0.1, 0.9, 0.95, 0.99]) WITHIN GROUP (ORDER BY x)) AS b
    FROM data
) foo;
  p   | ?column? | err 
------+----------+-----
 0.01 | t        |    
 0.05 | t        |    
  0.1 | t        |    
  0.9 | t        |    
 0.95 | t        |    
 0.99 | t        |    
(6 rows)

-- make sure the resulting percentiles are in the right order
WITH data AS (SELECT i / 1000000.0 AS x FROM generate_series(1,1000000) s(i)),
     perc AS (SELECT array_agg((i/100.0)::double precision) AS p FROM generate_series(1,99) s(i))
SELECT * FROM (
    SELECT
        p,
        a,
        LAG(a) OVER (ORDER BY p) AS b
    FROM (
        SELECT
            unnest((SELECT p FROM perc)) AS p,
            unnest(tdigest_percentile(x, 100, (SELECT p FROM perc))) AS a
        FROM data
    ) foo ) bar WHERE a <= b;
 p | a | b 
---+---+---
(0 rows)

-- 1000 centroids (very accurate)
WITH data AS (SELECT i / 1000000.0 AS x FROM generate_series(1,1000000) s(i))
SELECT
    p,
    abs(a - b) < 0.001, -- arbitrary threshold of 0.1%
    (CASE WHEN abs(a - b) < 0.001 THEN NULL ELSE (a - b) END) AS err
FROM (
    SELECT
        unnest(ARRAY[0.01, 0.05, 0.1, 0.9, 0.95, 0.99]) AS p,
        unnest(tdigest_percentile(x, 1000, ARRAY[0.01, 0.05, 0.1, 0.9, 0.95, 0.99])) AS a,
        unnest(percentile_cont(ARRAY[0.01, 0.05, 0.1, 0.9, 0.95, 0.99]) WITHIN GROUP (ORDER BY x)) AS b
    FROM data
) foo;
  p   | ?column? | err 
------+----------+-----
 0.01 | t        |    
 0.05 | t        |    
  0.1 | t        |    
  0.9 | t        |    
 0.95 | t        |    
 0.99 | t        |    
(6 rows)

-- make sure the resulting percentiles are in the right order
WITH data AS (SELECT i / 1000000.0 AS x FROM generate_series(1,1000000) s(i)),
     perc AS (SELECT array_agg((i/100.0)::double precision) AS p FROM generate_series(1,99) s(i))
SELECT * FROM (
    SELECT
        p,
        a,
        LAG(a) OVER (ORDER BY p) AS b
    FROM (
        SELECT
            unnest((SELECT p FROM perc)) AS p,
            unnest(tdigest_percentile(x, 1000, (SELECT p FROM perc))) AS a
        FROM data
    ) foo ) bar WHERE a <= b;
 p | a | b 
---+---+---
(0 rows)

------------------------------------------------------------
-- nice data set with ordered (desc) / evenly-spaced data --
------------------------------------------------------------
-- 10 centroids (tiny)
WITH data AS (SELECT i / 1000000.0 AS x FROM generate_series(1000000,1,-1) s(i))
SELECT
    p,
    abs(a - b) < 0.01, -- arbitrary threshold of 1%
    (CASE WHEN abs(a - b) < 0.01 THEN NULL ELSE (a - b) END) AS err
FROM (
    SELECT
        unnest(ARRAY[0.01, 0.05, 0.1, 0.9, 0.95, 0.99]) AS p,
        unnest(tdigest_percentile(x, 10, ARRAY[0.01, 0.05, 0.1, 0.9, 0.95, 0.99])) AS a,
        unnest(percentile_cont(ARRAY[0.01, 0.05, 0.1, 0.9, 0.95, 0.99]) WITHIN GROUP (ORDER BY x)) AS b
    FROM data
) foo;
  p   | ?column? | err 
------+----------+-----
 0.01 | t        |    
 0.05 | t        |    
  0.1 | t        |    
  0.9 | t        |    
 0.95 | t        |    
 0.99 | t        |    
(6 rows)

-- make sure the resulting percentiles are in the right order
WITH data AS (SELECT i / 1000000.0 AS x FROM generate_series(1000000,1,-1) s(i)),
     perc AS (SELECT array_agg((i/100.0)::double precision) AS p FROM generate_series(1,99) s(i))
SELECT * FROM (
    SELECT
        p,
        a,
        LAG(a) OVER (ORDER BY p) AS b
    FROM (
        SELECT
            unnest((SELECT p FROM perc)) AS p,
            unnest(tdigest_percentile(x, 10, (SELECT p FROM perc))) AS a
        FROM data
    ) foo ) bar WHERE a <= b;
 p | a | b 
---+---+---
(0 rows)

-- 100 centroids (okay-ish)
WITH data AS (SELECT i / 1000000.0 AS x FROM generate_series(1000000,1,-1) s(i))
SELECT
    p,
    abs(a - b) < 0.01, -- arbitrary threshold of 1%
    (CASE WHEN abs(a - b) < 0.01 THEN NULL ELSE (a - b) END) AS err
FROM (
    SELECT
        unnest(ARRAY[0.01, 0.05, 0.1, 0.9, 0.95, 0.99]) AS p,
        unnest(tdigest_percentile(x, 100, ARRAY[0.01, 0.05, 0.1, 0.9, 0.95, 0.99])) AS a,
        unnest(percentile_cont(ARRAY[0.01, 0.05, 0.1, 0.9, 0.95, 0.99]) WITHIN GROUP (ORDER BY x)) AS b
    FROM data
) foo;
  p   | ?column? | err 
------+----------+-----
 0.01 | t        |    
 0.05 | t        |    
  0.1 | t        |    
  0.9 | t        |    
 0.95 | t        |    
 0.99 | t        |    
(6 rows)

-- make sure the resulting percentiles are in the right order
WITH data AS (SELECT i / 1000000.0 AS x FROM generate_series(1000000,1,-1) s(i)),
     perc AS (SELECT array_agg((i/100.0)::double precision) AS p FROM generate_series(1,99) s(i))
SELECT * FROM (
    SELECT
        p,
        a,
        LAG(a) OVER (ORDER BY p) AS b
    FROM (
        SELECT
            unnest((SELECT p FROM perc)) AS p,
            unnest(tdigest_percentile(x, 100, (SELECT p FROM perc))) AS a
        FROM data
    ) foo ) bar WHERE a <= b;
 p | a | b 
---+---+---
(0 rows)

-- 1000 centroids (very accurate)
WITH data AS (SELECT i / 1000000.0 AS x FROM generate_series(1000000,1,-1) s(i))
SELECT
    p,
    abs(a - b) < 0.001, -- arbitrary threshold of 0.1%
    (CASE WHEN abs(a - b) < 0.001 THEN NULL ELSE (a - b) END) AS err
FROM (
    SELECT
        unnest(ARRAY[0.01, 0.05, 0.1, 0.9, 0.95, 0.99]) AS p,
        unnest(tdigest_percentile(x, 1000, ARRAY[0.01, 0.05, 0.1, 0.9, 0.95, 0.99])) AS a,
        unnest(percentile_cont(ARRAY[0.01, 0.05, 0.1, 0.9, 0.95, 0.99]) WITHIN GROUP (ORDER BY x)) AS b
    FROM data
) foo;
  p   | ?column? | err 
------+----------+-----
 0.01 | t        |    
 0.05 | t        |    
  0.1 | t        |    
  0.9 | t        |    
 0.95 | t        |    
 0.99 | t        |    
(6 rows)

-- make sure the resulting percentiles are in the right order
WITH data AS (SELECT i / 1000000.0 AS x FROM generate_series(1000000,1,-1) s(i)),
     perc AS (SELECT array_agg((i/100.0)::double precision) AS p FROM generate_series(1,99) s(i))
SELECT * FROM (
    SELECT
        p,
        a,
        LAG(a) OVER (ORDER BY p) AS b
    FROM (
        SELECT
            unnest((SELECT p FROM perc)) AS p,
            unnest(tdigest_percentile(x, 1000, (SELECT p FROM perc))) AS a
        FROM data
    ) foo ) bar WHERE a <= b;
 p | a | b 
---+---+---
(0 rows)

----------------------------------------------------
-- nice data set with random / evenly-spaced data --
----------------------------------------------------
-- 10 centroids (tiny)
WITH data AS (SELECT i / 1000000.0 AS x FROM (SELECT generate_series(1,1000000) AS i, prng(1000000, 49979693) AS x ORDER BY x) foo)
SELECT
    p,
    abs(a - b) < 0.1, -- arbitrary threshold of 10%
    (CASE WHEN abs(a - b) < 0.1 THEN NULL ELSE (a - b) END) AS err
FROM (
    SELECT
        unnest(ARRAY[0.01, 0.05, 0.1, 0.9, 0.95, 0.99]) AS p,
        unnest(tdigest_percentile(x, 10, ARRAY[0.01, 0.05, 0.1, 0.9, 0.95, 0.99])) AS a,
        unnest(percentile_cont(ARRAY[0.01, 0.05, 0.1, 0.9, 0.95, 0.99]) WITHIN GROUP (ORDER BY x)) AS b
    FROM data
) foo;
  p   | ?column? | err 
------+----------+-----
 0.01 | t        |    
 0.05 | t        |    
  0.1 | t        |    
  0.9 | t        |    
 0.95 | t        |    
 0.99 | t        |    
(6 rows)

-- make sure the resulting percentiles are in the right order
WITH data AS (SELECT i / 1000000.0 AS x FROM (SELECT generate_series(1,1000000) AS i, prng(1000000, 49979693) AS x ORDER BY x) foo),
     perc AS (SELECT array_agg((i/100.0)::double precision) AS p FROM generate_series(1,99) s(i))
SELECT * FROM (
    SELECT
        p,
        a,
        LAG(a) OVER (ORDER BY p) AS b
    FROM (
        SELECT
            unnest((SELECT p FROM perc)) AS p,
            unnest(tdigest_percentile(x, 10, (SELECT p FROM perc))) AS a
        FROM data
    ) foo ) bar WHERE a <= b;
 p | a | b 
---+---+---
(0 rows)

-- 100 centroids (okay-ish)
WITH data AS (SELECT i / 1000000.0 AS x FROM (SELECT generate_series(1,1000000) AS i, prng(1000000, 49979693) AS x ORDER BY x) foo)
SELECT
    p,
    abs(a - b) < 0.01, -- arbitrary threshold of 1%
    (CASE WHEN abs(a - b) < 0.01 THEN NULL ELSE (a - b) END) AS err
FROM (
    SELECT
        unnest(ARRAY[0.01, 0.05, 0.1, 0.9, 0.95, 0.99]) AS p,
        unnest(tdigest_percentile(x, 100, ARRAY[0.01, 0.05, 0.1, 0.9, 0.95, 0.99])) AS a,
        unnest(percentile_cont(ARRAY[0.01, 0.05, 0.1, 0.9, 0.95, 0.99]) WITHIN GROUP (ORDER BY x)) AS b
    FROM data
) foo;
  p   | ?column? | err 
------+----------+-----
 0.01 | t        |    
 0.05 | t        |    
  0.1 | t        |    
  0.9 | t        |    
 0.95 | t        |    
 0.99 | t        |    
(6 rows)

-- make sure the resulting percentiles are in the right order
WITH data AS (SELECT i / 1000000.0 AS x FROM (SELECT generate_series(1,1000000) AS i, prng(1000000, 49979693) AS x ORDER BY x) foo),
     perc AS (SELECT array_agg((i/100.0)::double precision) AS p FROM generate_series(1,99) s(i))
SELECT * FROM (
    SELECT
        p,
        a,
        LAG(a) OVER (ORDER BY p) AS b
    FROM (
        SELECT
            unnest((SELECT p FROM perc)) AS p,
            unnest(tdigest_percentile(x, 100, (SELECT p FROM perc))) AS a
        FROM data
    ) foo ) bar WHERE a <= b;
 p | a | b 
---+---+---
(0 rows)

-- 1000 centroids (very accurate)
WITH data AS (SELECT i / 1000000.0 AS x FROM (SELECT generate_series(1,1000000) AS i, prng(1000000, 49979693) AS x ORDER BY x) foo)
SELECT
    p,
    abs(a - b) < 0.001, -- arbitrary threshold of 0.1%
    (CASE WHEN abs(a - b) < 0.001 THEN NULL ELSE (a - b) END) AS err
FROM (
    SELECT
        unnest(ARRAY[0.01, 0.05, 0.1, 0.9, 0.95, 0.99]) AS p,
        unnest(tdigest_percentile(x, 1000, ARRAY[0.01, 0.05, 0.1, 0.9, 0.95, 0.99])) AS a,
        unnest(percentile_cont(ARRAY[0.01, 0.05, 0.1, 0.9, 0.95, 0.99]) WITHIN GROUP (ORDER BY x)) AS b
    FROM data
) foo;
  p   | ?column? | err 
------+----------+-----
 0.01 | t        |    
 0.05 | t        |    
  0.1 | t        |    
  0.9 | t        |    
 0.95 | t        |    
 0.99 | t        |    
(6 rows)

-- make sure the resulting percentiles are in the right order
WITH data AS (SELECT i / 1000000.0 AS x FROM (SELECT generate_series(1,1000000) AS i, prng(1000000, 49979693) AS x ORDER BY x) foo),
     perc AS (SELECT array_agg((i/100.0)::double precision) AS p FROM generate_series(1,99) s(i))
SELECT * FROM (
    SELECT
        p,
        a,
        LAG(a) OVER (ORDER BY p) AS b
    FROM (
        SELECT
            unnest((SELECT p FROM perc)) AS p,
            unnest(tdigest_percentile(x, 1000, (SELECT p FROM perc))) AS a
        FROM data
    ) foo ) bar WHERE a <= b;
 p | a | b 
---+---+---
(0 rows)

----------------------------------------------
-- nice data set with random data (uniform) --
----------------------------------------------
-- 10 centroids (tiny)
WITH data AS (SELECT x FROM prng(1000000) s(x))
SELECT
    p,
    abs(a - b) < 0.1, -- arbitrary threshold of 10%
    (CASE WHEN abs(a - b) < 0.1 THEN NULL ELSE (a - b) END) AS err
FROM (
    SELECT
        unnest(ARRAY[0.01, 0.05, 0.1, 0.9, 0.95, 0.99]) AS p,
        unnest(tdigest_percentile(x, 10, ARRAY[0.01, 0.05, 0.1, 0.9, 0.95, 0.99])) AS a,
        unnest(percentile_cont(ARRAY[0.01, 0.05, 0.1, 0.9, 0.95, 0.99]) WITHIN GROUP (ORDER BY x)) AS b
    FROM data
) foo;
  p   | ?column? | err 
------+----------+-----
 0.01 | t        |    
 0.05 | t        |    
  0.1 | t        |    
  0.9 | t        |    
 0.95 | t        |    
 0.99 | t        |    
(6 rows)

-- make sure the resulting percentiles are in the right order
WITH data AS (SELECT x FROM prng(1000000) s(x)),
     perc AS (SELECT array_agg((i/100.0)::double precision) AS p FROM generate_series(1,99) s(i))
SELECT * FROM (
    SELECT
        p,
        a,
        LAG(a) OVER (ORDER BY p) AS b
    FROM (
        SELECT
            unnest((SELECT p FROM perc)) AS p,
            unnest(tdigest_percentile(x, 10, (SELECT p FROM perc))) AS a
        FROM data
    ) foo ) bar WHERE a <= b;
 p | a | b 
---+---+---
(0 rows)

-- 100 centroids (okay-ish)
WITH data AS (SELECT x FROM prng(1000000) s(x))
SELECT
    p,
    abs(a - b) < 0.01, -- arbitrary threshold of 1%
    (CASE WHEN abs(a - b) < 0.01 THEN NULL ELSE (a - b) END) AS err
FROM (
    SELECT
        unnest(ARRAY[0.01, 0.05, 0.1, 0.9, 0.95, 0.99]) AS p,
        unnest(tdigest_percentile(x, 100, ARRAY[0.01, 0.05, 0.1, 0.9, 0.95, 0.99])) AS a,
        unnest(percentile_cont(ARRAY[0.01, 0.05, 0.1, 0.9, 0.95, 0.99]) WITHIN GROUP (ORDER BY x)) AS b
    FROM data
) foo;
  p   | ?column? | err 
------+----------+-----
 0.01 | t        |    
 0.05 | t        |    
  0.1 | t        |    
  0.9 | t        |    
 0.95 | t        |    
 0.99 | t        |    
(6 rows)

-- make sure the resulting percentiles are in the right order
WITH data AS (SELECT x FROM prng(1000000) s(x)),
     perc AS (SELECT array_agg((i/100.0)::double precision) AS p FROM generate_series(1,99) s(i))
SELECT * FROM (
    SELECT
        p,
        a,
        LAG(a) OVER (ORDER BY p) AS b
    FROM (
        SELECT
            unnest((SELECT p FROM perc)) AS p,
            unnest(tdigest_percentile(x, 100, (SELECT p FROM perc))) AS a
        FROM data
    ) foo ) bar WHERE a <= b;
 p | a | b 
---+---+---
(0 rows)

-- 1000 centroids (very accurate)
WITH data AS (SELECT x FROM prng(1000000) s(x))
SELECT
    p,
    abs(a - b) < 0.001, -- arbitrary threshold of 0.1%
    (CASE WHEN abs(a - b) < 0.001 THEN NULL ELSE (a - b) END) AS err
FROM (
    SELECT
        unnest(ARRAY[0.01, 0.05, 0.1, 0.9, 0.95, 0.99]) AS p,
        unnest(tdigest_percentile(x, 1000, ARRAY[0.01, 0.05, 0.1, 0.9, 0.95, 0.99])) AS a,
        unnest(percentile_cont(ARRAY[0.01, 0.05, 0.1, 0.9, 0.95, 0.99]) WITHIN GROUP (ORDER BY x)) AS b
    FROM data
) foo;
  p   | ?column? | err 
------+----------+-----
 0.01 | t        |    
 0.05 | t        |    
  0.1 | t        |    
  0.9 | t        |    
 0.95 | t        |    
 0.99 | t        |    
(6 rows)

-- make sure the resulting percentiles are in the right order
WITH data AS (SELECT x FROM prng(1000000) s(x)),
     perc AS (SELECT array_agg((i/100.0)::double precision) AS p FROM generate_series(1,99) s(i))
SELECT * FROM (
    SELECT
        p,
        a,
        LAG(a) OVER (ORDER BY p) AS b
    FROM (
        SELECT
            unnest((SELECT p FROM perc)) AS p,
            unnest(tdigest_percentile(x, 1000, (SELECT p FROM perc))) AS a
        FROM data
    ) foo ) bar WHERE a <= b;
 p | a | b 
---+---+---
(0 rows)

--------------------------------------------------
-- nice data set with random data (skewed sqrt) --
--------------------------------------------------
-- 10 centroids (tiny)
WITH data AS (SELECT sqrt(z) AS x FROM prng(1000000) s(z))
SELECT
    p,
    abs(a - b) < 0.1, -- arbitrary threshold of 10%
    (CASE WHEN abs(a - b) < 0.1 THEN NULL ELSE (a - b) END) AS err
FROM (
    SELECT
        unnest(ARRAY[0.01, 0.05, 0.1, 0.9, 0.95, 0.99]) AS p,
        unnest(tdigest_percentile(x, 10, ARRAY[0.01, 0.05, 0.1, 0.9, 0.95, 0.99])) AS a,
        unnest(percentile_cont(ARRAY[0.01, 0.05, 0.1, 0.9, 0.95, 0.99]) WITHIN GROUP (ORDER BY x)) AS b
    FROM data
) foo;
  p   | ?column? | err 
------+----------+-----
 0.01 | t        |    
 0.05 | t        |    
  0.1 | t        |    
  0.9 | t        |    
 0.95 | t        |    
 0.99 | t        |    
(6 rows)

-- make sure the resulting percentiles are in the right order
WITH data AS (SELECT sqrt(z) AS x FROM prng(1000000) s(z)),
     perc AS (SELECT array_agg((i/100.0)::double precision) AS p FROM generate_series(1,99) s(i))
SELECT * FROM (
    SELECT
        p,
        a,
        LAG(a) OVER (ORDER BY p) AS b
    FROM (
        SELECT
            unnest((SELECT p FROM perc)) AS p,
            unnest(tdigest_percentile(x, 10, (SELECT p FROM perc))) AS a
        FROM data
    ) foo ) bar WHERE a <= b;
 p | a | b 
---+---+---
(0 rows)

-- 100 centroids (okay-ish)
WITH data AS (SELECT sqrt(z) AS x FROM prng(1000000) s(z))
SELECT
    p,
    abs(a - b) < 0.01, -- arbitrary threshold of 1%
    (CASE WHEN abs(a - b) < 0.01 THEN NULL ELSE (a - b) END) AS err
FROM (
    SELECT
        unnest(ARRAY[0.01, 0.05, 0.1, 0.9, 0.95, 0.99]) AS p,
        unnest(tdigest_percentile(x, 100, ARRAY[0.01, 0.05, 0.1, 0.9, 0.95, 0.99])) AS a,
        unnest(percentile_cont(ARRAY[0.01, 0.05, 0.1, 0.9, 0.95, 0.99]) WITHIN GROUP (ORDER BY x)) AS b
    FROM data
) foo;
  p   | ?column? | err 
------+----------+-----
 0.01 | t        |    
 0.05 | t        |    
  0.1 | t        |    
  0.9 | t        |    
 0.95 | t        |    
 0.99 | t        |    
(6 rows)

-- make sure the resulting percentiles are in the right order
WITH data AS (SELECT sqrt(z) AS x FROM prng(1000000) s(z)),
     perc AS (SELECT array_agg((i/100.0)::double precision) AS p FROM generate_series(1,99) s(i))
SELECT * FROM (
    SELECT
        p,
        a,
        LAG(a) OVER (ORDER BY p) AS b
    FROM (
        SELECT
            unnest((SELECT p FROM perc)) AS p,
            unnest(tdigest_percentile(x, 100, (SELECT p FROM perc))) AS a
        FROM data
    ) foo ) bar WHERE a <= b;
 p | a | b 
---+---+---
(0 rows)

-- 1000 centroids (very accurate)
WITH data AS (SELECT sqrt(z) AS x FROM prng(1000000) s(z))
SELECT
    p,
    abs(a - b) < 0.001, -- arbitrary threshold of 0.1%
    (CASE WHEN abs(a - b) < 0.001 THEN NULL ELSE (a - b) END) AS err
FROM (
    SELECT
        unnest(ARRAY[0.01, 0.05, 0.1, 0.9, 0.95, 0.99]) AS p,
        unnest(tdigest_percentile(x, 1000, ARRAY[0.01, 0.05, 0.1, 0.9, 0.95, 0.99])) AS a,
        unnest(percentile_cont(ARRAY[0.01, 0.05, 0.1, 0.9, 0.95, 0.99]) WITHIN GROUP (ORDER BY x)) AS b
    FROM data
) foo;
  p   | ?column? | err 
------+----------+-----
 0.01 | t        |    
 0.05 | t        |    
  0.1 | t        |    
  0.9 | t        |    
 0.95 | t        |    
 0.99 | t        |    
(6 rows)

-- make sure the resulting percentiles are in the right order
WITH data AS (SELECT sqrt(z) AS x FROM prng(1000000) s(z)),
     perc AS (SELECT array_agg((i/100.0)::double precision) AS p FROM generate_series(1,99) s(i))
SELECT * FROM (
    SELECT
        p,
        a,
        LAG(a) OVER (ORDER BY p) AS b
    FROM (
        SELECT
            unnest((SELECT p FROM perc)) AS p,
            unnest(tdigest_percentile(x, 1000, (SELECT p FROM perc))) AS a
        FROM data
    ) foo ) bar WHERE a <= b;
 p | a | b 
---+---+---
(0 rows)

-------------------------------------------------------
-- nice data set with random data (skewed sqrt+sqrt) --
-------------------------------------------------------
-- 10 centroids (tiny)
WITH data AS (SELECT sqrt(sqrt(z)) AS x FROM prng(1000000) s(z))
SELECT
    p,
    abs(a - b) < 0.1, -- arbitrary threshold of 10%
    (CASE WHEN abs(a - b) < 0.1 THEN NULL ELSE (a - b) END) AS err
FROM (
    SELECT
        unnest(ARRAY[0.01, 0.05, 0.1, 0.9, 0.95, 0.99]) AS p,
        unnest(tdigest_percentile(x, 10, ARRAY[0.01, 0.05, 0.1, 0.9, 0.95, 0.99])) AS a,
        unnest(percentile_cont(ARRAY[0.01, 0.05, 0.1, 0.9, 0.95, 0.99]) WITHIN GROUP (ORDER BY x)) AS b
    FROM data
) foo;
  p   | ?column? | err 
------+----------+-----
 0.01 | t        |    
 0.05 | t        |    
  0.1 | t        |    
  0.9 | t        |    
 0.95 | t        |    
 0.99 | t        |    
(6 rows)

-- make sure the resulting percentiles are in the right order
WITH data AS (SELECT sqrt(sqrt(z)) AS x FROM prng(1000000) s(z)),
     perc AS (SELECT array_agg((i/100.0)::double precision) AS p FROM generate_series(1,99) s(i))
SELECT * FROM (
    SELECT
        p,
        a,
        LAG(a) OVER (ORDER BY p) AS b
    FROM (
        SELECT
            unnest((SELECT p FROM perc)) AS p,
            unnest(tdigest_percentile(x, 10, (SELECT p FROM perc))) AS a
        FROM data
    ) foo ) bar WHERE a <= b;
 p | a | b 
---+---+---
(0 rows)

-- 100 centroids (okay-ish)
WITH data AS (SELECT sqrt(sqrt(z)) AS x FROM prng(1000000) s(z))
SELECT
    p,
    abs(a - b) < 0.01, -- arbitrary threshold of 1%
    (CASE WHEN abs(a - b) < 0.01 THEN NULL ELSE (a - b) END) AS err
FROM (
    SELECT
        unnest(ARRAY[0.01, 0.05, 0.1, 0.9, 0.95, 0.99]) AS p,
        unnest(tdigest_percentile(x, 100, ARRAY[0.01, 0.05, 0.1, 0.9, 0.95, 0.99])) AS a,
        unnest(percentile_cont(ARRAY[0.01, 0.05, 0.1, 0.9, 0.95, 0.99]) WITHIN GROUP (ORDER BY x)) AS b
    FROM data
) foo;
  p   | ?column? | err 
------+----------+-----
 0.01 | t        |    
 0.05 | t        |    
  0.1 | t        |    
  0.9 | t        |    
 0.95 | t        |    
 0.99 | t        |    
(6 rows)

-- make sure the resulting percentiles are in the right order
WITH data AS (SELECT sqrt(sqrt(z)) AS x FROM prng(1000000) s(z)),
     perc AS (SELECT array_agg((i/100.0)::double precision) AS p FROM generate_series(1,99) s(i))
SELECT * FROM (
    SELECT
        p,
        a,
        LAG(a) OVER (ORDER BY p) AS b
    FROM (
        SELECT
            unnest((SELECT p FROM perc)) AS p,
            unnest(tdigest_percentile(x, 100, (SELECT p FROM perc))) AS a
        FROM data
    ) foo ) bar WHERE a <= b;
 p | a | b 
---+---+---
(0 rows)

-- 1000 centroids (very accurate)
WITH data AS (SELECT sqrt(sqrt(z)) AS x FROM prng(1000000) s(z))
SELECT
    p,
    abs(a - b) < 0.001, -- arbitrary threshold of 0.1%
    (CASE WHEN abs(a - b) < 0.001 THEN NULL ELSE (a - b) END) AS err
FROM (
    SELECT
        unnest(ARRAY[0.01, 0.05, 0.1, 0.9, 0.95, 0.99]) AS p,
        unnest(tdigest_percentile(x, 1000, ARRAY[0.01, 0.05, 0.1, 0.9, 0.95, 0.99])) AS a,
        unnest(percentile_cont(ARRAY[0.01, 0.05, 0.1, 0.9, 0.95, 0.99]) WITHIN GROUP (ORDER BY x)) AS b
    FROM data
) foo;
  p   | ?column? | err 
------+----------+-----
 0.01 | t        |    
 0.05 | t        |    
  0.1 | t        |    
  0.9 | t        |    
 0.95 | t        |    
 0.99 | t        |    
(6 rows)

-- make sure the resulting percentiles are in the right order
WITH data AS (SELECT sqrt(sqrt(z)) AS x FROM prng(1000000) s(z)),
     perc AS (SELECT array_agg((i/100.0)::double precision) AS p FROM generate_series(1,99) s(i))
SELECT * FROM (
    SELECT
        p,
        a,
        LAG(a) OVER (ORDER BY p) AS b
    FROM (
        SELECT
            unnest((SELECT p FROM perc)) AS p,
            unnest(tdigest_percentile(x, 1000, (SELECT p FROM perc))) AS a
        FROM data
    ) foo ) bar WHERE a <= b;
 p | a | b 
---+---+---
(0 rows)

-------------------------------------------------
-- nice data set with random data (skewed pow) --
-------------------------------------------------
-- 10 centroids (tiny)
WITH data AS (SELECT pow(z, 2) AS x FROM prng(1000000) s(z))
SELECT
    p,
    abs(a - b) < 0.1, -- arbitrary threshold of 10%
    (CASE WHEN abs(a - b) < 0.1 THEN NULL ELSE (a - b) END) AS err
FROM (
    SELECT
        unnest(ARRAY[0.01, 0.05, 0.1, 0.9, 0.95, 0.99]) AS p,
        unnest(tdigest_percentile(x, 10, ARRAY[0.01, 0.05, 0.1, 0.9, 0.95, 0.99])) AS a,
        unnest(percentile_cont(ARRAY[0.01, 0.05, 0.1, 0.9, 0.95, 0.99]) WITHIN GROUP (ORDER BY x)) AS b
    FROM data
) foo;
  p   | ?column? | err 
------+----------+-----
 0.01 | t        |    
 0.05 | t        |    
  0.1 | t        |    
  0.9 | t        |    
 0.95 | t        |    
 0.99 | t        |    
(6 rows)

-- make sure the resulting percentiles are in the right order
WITH data AS (SELECT pow(z, 2) AS x FROM prng(1000000) s(z)),
     perc AS (SELECT array_agg((i/100.0)::double precision) AS p FROM generate_series(1,99) s(i))
SELECT * FROM (
    SELECT
        p,
        a,
        LAG(a) OVER (ORDER BY p) AS b
    FROM (
        SELECT
            unnest((SELECT p FROM perc)) AS p,
            unnest(tdigest_percentile(x, 10, (SELECT p FROM perc))) AS a
        FROM data
    ) foo ) bar WHERE a <= b;
 p | a | b 
---+---+---
(0 rows)

-- 100 centroids (okay-ish)
WITH data AS (SELECT pow(z, 2) AS x FROM prng(1000000) s(z))
SELECT
    p,
    abs(a - b) < 0.005, -- arbitrary threshold of 0.5%
    (CASE WHEN abs(a - b) < 0.005 THEN NULL ELSE (a - b) END) AS err
FROM (
    SELECT
        unnest(ARRAY[0.01, 0.05, 0.1, 0.9, 0.95, 0.99]) AS p,
        unnest(tdigest_percentile(x, 100, ARRAY[0.01, 0.05, 0.1, 0.9, 0.95, 0.99])) AS a,
        unnest(percentile_cont(ARRAY[0.01, 0.05, 0.1, 0.9, 0.95, 0.99]) WITHIN GROUP (ORDER BY x)) AS b
    FROM data
) foo;
  p   | ?column? | err 
------+----------+-----
 0.01 | t        |    
 0.05 | t        |    
  0.1 | t        |    
  0.9 | t        |    
 0.95 | t        |    
 0.99 | t        |    
(6 rows)

-- make sure the resulting percentiles are in the right order
WITH data AS (SELECT pow(z, 2) AS x FROM prng(1000000) s(z)),
     perc AS (SELECT array_agg((i/100.0)::double precision) AS p FROM generate_series(1,99) s(i))
SELECT * FROM (
    SELECT
        p,
        a,
        LAG(a) OVER (ORDER BY p) AS b
    FROM (
        SELECT
            unnest((SELECT p FROM perc)) AS p,
            unnest(tdigest_percentile(x, 100, (SELECT p FROM perc))) AS a
        FROM data
    ) foo ) bar WHERE a <= b;
 p | a | b 
---+---+---
(0 rows)

-- 1000 centroids (very accurate)
WITH data AS (SELECT pow(z, 2) AS x FROM prng(1000000) s(z))
SELECT
    p,
    abs(a - b) < 0.001, -- arbitrary threshold of 0.1%
    (CASE WHEN abs(a - b) < 0.001 THEN NULL ELSE (a - b) END) AS err
FROM (
    SELECT
        unnest(ARRAY[0.01, 0.05, 0.1, 0.9, 0.95, 0.99]) AS p,
        unnest(tdigest_percentile(x, 1000, ARRAY[0.01, 0.05, 0.1, 0.9, 0.95, 0.99])) AS a,
        unnest(percentile_cont(ARRAY[0.01, 0.05, 0.1, 0.9, 0.95, 0.99]) WITHIN GROUP (ORDER BY x)) AS b
    FROM data
) foo;
  p   | ?column? | err 
------+----------+-----
 0.01 | t        |    
 0.05 | t        |    
  0.1 | t        |    
  0.9 | t        |    
 0.95 | t        |    
 0.99 | t        |    
(6 rows)

-- make sure the resulting percentiles are in the right order
WITH data AS (SELECT pow(z, 2) AS x FROM prng(1000000) s(z)),
     perc AS (SELECT array_agg((i/100.0)::double precision) AS p FROM generate_series(1,99) s(i))
SELECT * FROM (
    SELECT
        p,
        a,
        LAG(a) OVER (ORDER BY p) AS b
    FROM (
        SELECT
            unnest((SELECT p FROM perc)) AS p,
            unnest(tdigest_percentile(x, 1000, (SELECT p FROM perc))) AS a
        FROM data
    ) foo ) bar WHERE a <= b;
 p | a | b 
---+---+---
(0 rows)

-----------------------------------------------------
-- nice data set with random data (skewed pow+pow) --
-----------------------------------------------------
-- 10 centroids (tiny)
WITH data AS (SELECT pow(z, 4) AS x FROM prng(1000000) s(z))
SELECT
    p,
    abs(a - b) < 0.1, -- arbitrary threshold of 10%
    (CASE WHEN abs(a - b) < 0.1 THEN NULL ELSE (a - b) END) AS err
FROM (
    SELECT
        unnest(ARRAY[0.01, 0.05, 0.1, 0.9, 0.95, 0.99]) AS p,
        unnest(tdigest_percentile(x, 10, ARRAY[0.01, 0.05, 0.1, 0.9, 0.95, 0.99])) AS a,
        unnest(percentile_cont(ARRAY[0.01, 0.05, 0.1, 0.9, 0.95, 0.99]) WITHIN GROUP (ORDER BY x)) AS b
    FROM data
) foo;
  p   | ?column? | err 
------+----------+-----
 0.01 | t        |    
 0.05 | t        |    
  0.1 | t        |    
  0.9 | t        |    
 0.95 | t        |    
 0.99 | t        |    
(6 rows)

-- make sure the resulting percentiles are in the right order
WITH data AS (SELECT pow(z, 4) AS x FROM prng(1000000) s(z)),
     perc AS (SELECT array_agg((i/100.0)::double precision) AS p FROM generate_series(1,99) s(i))
SELECT * FROM (
    SELECT
        p,
        a,
        LAG(a) OVER (ORDER BY p) AS b
    FROM (
        SELECT
            unnest((SELECT p FROM perc)) AS p,
            unnest(tdigest_percentile(x, 10, (SELECT p FROM perc))) AS a
        FROM data
    ) foo ) bar WHERE a <= b;
 p | a | b 
---+---+---
(0 rows)

-- 100 centroids (okay-ish)
WITH data AS (SELECT pow(z, 4) AS x FROM prng(1000000) s(z))
SELECT
    p,
    abs(a - b) < 0.01, -- arbitrary threshold of 1%
    (CASE WHEN abs(a - b) < 0.01 THEN NULL ELSE (a - b) END) AS err
FROM (
    SELECT
        unnest(ARRAY[0.01, 0.05, 0.1, 0.9, 0.95, 0.99]) AS p,
        unnest(tdigest_percentile(x, 100, ARRAY[0.01, 0.05, 0.1, 0.9, 0.95, 0.99])) AS a,
        unnest(percentile_cont(ARRAY[0.01, 0.05, 0.1, 0.9, 0.95, 0.99]) WITHIN GROUP (ORDER BY x)) AS b
    FROM data
) foo;
  p   | ?column? | err 
------+----------+-----
 0.01 | t        |    
 0.05 | t        |    
  0.1 | t        |    
  0.9 | t        |    
 0.95 | t        |    
 0.99 | t        |    
(6 rows)

-- make sure the resulting percentiles are in the right order
WITH data AS (SELECT pow(z, 4) AS x FROM prng(1000000) s(z)),
     perc AS (SELECT array_agg((i/100.0)::double precision) AS p FROM generate_series(1,99) s(i))
SELECT * FROM (
    SELECT
        p,
        a,
        LAG(a) OVER (ORDER BY p) AS b
    FROM (
        SELECT
            unnest((SELECT p FROM perc)) AS p,
            unnest(tdigest_percentile(x, 100, (SELECT p FROM perc))) AS a
        FROM data
    ) foo ) bar WHERE a <= b;
 p | a | b 
---+---+---
(0 rows)

-- 1000 centroids (very accurate)
WITH data AS (SELECT pow(z, 4) AS x FROM prng(1000000) s(z))
SELECT
    p,
    abs(a - b) < 0.001, -- arbitrary threshold of 0.1%
    (CASE WHEN abs(a - b) < 0.001 THEN NULL ELSE (a - b) END) AS err
FROM (
    SELECT
        unnest(ARRAY[0.01, 0.05, 0.1, 0.9, 0.95, 0.99]) AS p,
        unnest(tdigest_percentile(x, 1000, ARRAY[0.01, 0.05, 0.1, 0.9, 0.95, 0.99])) AS a,
        unnest(percentile_cont(ARRAY[0.01, 0.05, 0.1, 0.9, 0.95, 0.99]) WITHIN GROUP (ORDER BY x)) AS b
    FROM data
) foo;
  p   | ?column? | err 
------+----------+-----
 0.01 | t        |    
 0.05 | t        |    
  0.1 | t        |    
  0.9 | t        |    
 0.95 | t        |    
 0.99 | t        |    
(6 rows)

-- make sure the resulting percentiles are in the right order
WITH data AS (SELECT pow(z, 4) AS x FROM prng(1000000) s(z)),
     perc AS (SELECT array_agg((i/100.0)::double precision) AS p FROM generate_series(1,99) s(i))
SELECT * FROM (
    SELECT
        p,
        a,
        LAG(a) OVER (ORDER BY p) AS b
    FROM (
        SELECT
            unnest((SELECT p FROM perc)) AS p,
            unnest(tdigest_percentile(x, 1000, (SELECT p FROM perc))) AS a
        FROM data
    ) foo ) bar WHERE a <= b;
 p | a | b 
---+---+---
(0 rows)

----------------------------------------------------------
-- nice data set with random data (normal distribution) --
----------------------------------------------------------
-- 10 centroids (tiny)
WITH data AS (SELECT pow(z, 4) AS x FROM random_normal(1000000) s(z))
SELECT
    p,
    abs(a - b) < 0.025, -- arbitrary threshold of 2.5%
    (CASE WHEN abs(a - b) < 0.025 THEN NULL ELSE (a - b) END) AS err
FROM (
    SELECT
        unnest(ARRAY[0.01, 0.05, 0.1, 0.9, 0.95, 0.99]) AS p,
        unnest(tdigest_percentile(x, 10, ARRAY[0.01, 0.05, 0.1, 0.9, 0.95, 0.99])) AS a,
        unnest(percentile_cont(ARRAY[0.01, 0.05, 0.1, 0.9, 0.95, 0.99]) WITHIN GROUP (ORDER BY x)) AS b
    FROM data
) foo;
  p   | ?column? | err 
------+----------+-----
 0.01 | t        |    
 0.05 | t        |    
  0.1 | t        |    
  0.9 | t        |    
 0.95 | t        |    
 0.99 | t        |    
(6 rows)

-- make sure the resulting percentiles are in the right order
WITH data AS (SELECT pow(z, 4) AS x FROM random_normal(1000000) s(z)),
     perc AS (SELECT array_agg((i/100.0)::double precision) AS p FROM generate_series(1,99) s(i))
SELECT * FROM (
    SELECT
        p,
        a,
        LAG(a) OVER (ORDER BY p) AS b
    FROM (
        SELECT
            unnest((SELECT p FROM perc)) AS p,
            unnest(tdigest_percentile(x, 10, (SELECT p FROM perc))) AS a
        FROM data
    ) foo ) bar WHERE a <= b;
 p | a | b 
---+---+---
(0 rows)

-- 100 centroids (okay-ish)
WITH data AS (SELECT pow(z, 4) AS x FROM random_normal(1000000) s(z))
SELECT
    p,
    abs(a - b) < 0.01, -- arbitrary threshold of 1%
    (CASE WHEN abs(a - b) < 0.01 THEN NULL ELSE (a - b) END) AS err
FROM (
    SELECT
        unnest(ARRAY[0.01, 0.05, 0.1, 0.9, 0.95, 0.99]) AS p,
        unnest(tdigest_percentile(x, 100, ARRAY[0.01, 0.05, 0.1, 0.9, 0.95, 0.99])) AS a,
        unnest(percentile_cont(ARRAY[0.01, 0.05, 0.1, 0.9, 0.95, 0.99]) WITHIN GROUP (ORDER BY x)) AS b
    FROM data
) foo;
  p   | ?column? | err 
------+----------+-----
 0.01 | t        |    
 0.05 | t        |    
  0.1 | t        |    
  0.9 | t        |    
 0.95 | t        |    
 0.99 | t        |    
(6 rows)

-- make sure the resulting percentiles are in the right order
WITH data AS (SELECT pow(z, 4) AS x FROM random_normal(1000000) s(z)),
     perc AS (SELECT array_agg((i/100.0)::double precision) AS p FROM generate_series(1,99) s(i))
SELECT * FROM (
    SELECT
        p,
        a,
        LAG(a) OVER (ORDER BY p) AS b
    FROM (
        SELECT
            unnest((SELECT p FROM perc)) AS p,
            unnest(tdigest_percentile(x, 100, (SELECT p FROM perc))) AS a
        FROM data
    ) foo ) bar WHERE a <= b;
 p | a | b 
---+---+---
(0 rows)

-- 1000 centroids (very accurate)
WITH data AS (SELECT pow(z, 4) AS x FROM random_normal(1000000) s(z))
SELECT
    p,
    abs(a - b) < 0.001, -- arbitrary threshold of 0.1%
    (CASE WHEN abs(a - b) < 0.001 THEN NULL ELSE (a - b) END) AS err
FROM (
    SELECT
        unnest(ARRAY[0.01, 0.05, 0.1, 0.9, 0.95, 0.99]) AS p,
        unnest(tdigest_percentile(x, 1000, ARRAY[0.01, 0.05, 0.1, 0.9, 0.95, 0.99])) AS a,
        unnest(percentile_cont(ARRAY[0.01, 0.05, 0.1, 0.9, 0.95, 0.99]) WITHIN GROUP (ORDER BY x)) AS b
    FROM data
) foo;
  p   | ?column? | err 
------+----------+-----
 0.01 | t        |    
 0.05 | t        |    
  0.1 | t        |    
  0.9 | t        |    
 0.95 | t        |    
 0.99 | t        |    
(6 rows)

-- make sure the resulting percentiles are in the right order
WITH data AS (SELECT pow(z, 4) AS x FROM random_normal(1000000) s(z)),
     perc AS (SELECT array_agg((i/100.0)::double precision) AS p FROM generate_series(1,99) s(i))
SELECT * FROM (
    SELECT
        p,
        a,
        LAG(a) OVER (ORDER BY p) AS b
    FROM (
        SELECT
            unnest((SELECT p FROM perc)) AS p,
            unnest(tdigest_percentile(x, 1000, (SELECT p FROM perc))) AS a
        FROM data
    ) foo ) bar WHERE a <= b;
 p | a | b 
---+---+---
(0 rows)

-- some basic tests to verify transforming from and to text work
-- 10 centroids (tiny)
WITH data AS (SELECT i / 1000000.0 AS x FROM generate_series(1,1000000) s(i)),
     intermediate AS (SELECT tdigest(x, 10)::text AS intermediate_x FROM data),
     tdigest_parsed AS (SELECT tdigest_percentile(intermediate_x::tdigest, ARRAY[0.01, 0.05, 0.1, 0.9, 0.95, 0.99]) AS a FROM intermediate),
     pg_percentile AS (SELECT percentile_cont(ARRAY[0.01, 0.05, 0.1, 0.9, 0.95, 0.99]) WITHIN GROUP (ORDER BY x) AS b FROM data)
SELECT
    p,
    abs(a - b) < 0.01, -- arbitrary threshold of 1%
    (CASE WHEN abs(a - b) < 0.01 THEN NULL ELSE (a - b) END) AS err
FROM (
    SELECT
        unnest(ARRAY[0.01, 0.05, 0.1, 0.9, 0.95, 0.99]) AS p,
        unnest(a) AS a,
        unnest(b) AS b
    FROM tdigest_parsed,
         pg_percentile
) foo;
  p   | ?column? | err 
------+----------+-----
 0.01 | t        |    
 0.05 | t        |    
  0.1 | t        |    
  0.9 | t        |    
 0.95 | t        |    
 0.99 | t        |    
(6 rows)

-- verify we can store tdigest in a summary table
CREATE TABLE intermediate_tdigest (grouping int, summary tdigest);
WITH data AS (SELECT row_number() OVER () AS i, pow(z, 4) AS x FROM random_normal(1000000) s(z))
INSERT INTO intermediate_tdigest
SELECT
    i % 10 AS grouping,
    tdigest(x, 100) AS summary
FROM data
GROUP BY i % 10;
WITH data AS (SELECT pow(z, 4) AS x FROM random_normal(1000000) s(z)),
     intermediate AS (SELECT tdigest_percentile(summary, ARRAY[0.01, 0.05, 0.1, 0.9, 0.95, 0.99]) AS a FROM intermediate_tdigest),
     pg_percentile AS (SELECT percentile_cont(ARRAY[0.01, 0.05, 0.1, 0.9, 0.95, 0.99]) WITHIN GROUP (ORDER BY x) AS b FROM data)
SELECT
    p,
    abs(a - b) < 0.01, -- arbitrary threshold of 1%
    (CASE WHEN abs(a - b) < 0.01 THEN NULL ELSE (a - b) END) AS err
FROM (
    SELECT
        unnest(ARRAY[0.01, 0.05, 0.1, 0.9, 0.95, 0.99]) AS p,
        unnest(a) AS a,
        unnest(b) AS b
    FROM intermediate,
         pg_percentile
) foo;
  p   | ?column? | err 
------+----------+-----
 0.01 | t        |    
 0.05 | t        |    
  0.1 | t        |    
  0.9 | t        |    
 0.95 | t        |    
 0.99 | t        |    
(6 rows)

-- verify 'extreme' percentiles for the dataset would not read out of bounds on the centroids
WITH data AS (SELECT x FROM generate_series(1,10) AS x)
SELECT
    p,
    abs(a - b) < 0.1, -- arbitrary threshold of 10% given the small dataset and extreme percentiles it is not very accurate
    (CASE WHEN abs(a - b) < 0.1 THEN NULL ELSE (a - b) END) AS err
FROM (
    SELECT
        unnest(ARRAY[0.01, 0.99]) AS p,
        unnest(tdigest_percentile(x, 10, ARRAY[0.01, 0.99])) AS a,
        unnest(percentile_cont(ARRAY[0.01, 0.99]) WITHIN GROUP (ORDER BY x)) AS b
    FROM data
) foo;
  p   | ?column? | err 
------+----------+-----
 0.01 | t        |    
 0.99 | t        |    
(2 rows)

-- check that the computed percentiles are perfectly correlated (don't decrease for higher p values)
-- first test on a tiny t-digest with all centroids having count = 1
WITH
-- percentiles to compute
perc AS (SELECT array_agg((i / 100.0)::double precision) AS percentiles FROM generate_series(1,99) s(i)),
-- input data (just 15 points)
input_data AS (select i::double precision AS val FROM generate_series(1,15) s(i))
SELECT * FROM (
    SELECT p, v AS v1, lag(v, 1) OVER (ORDER BY p) v2 FROM (
        SELECT
            unnest(perc.percentiles) p,
            unnest(tdigest_percentile(input_data.val, 100, perc.percentiles)) v
        FROM perc, input_data
        GROUP BY perc.percentiles
    ) foo
) bar where v2 > v1;
 p | v1 | v2 
---+----+----
(0 rows)

-- test casting to json
SELECT cast(tdigest(i / 10000.0, 10) as json) from generate_series(1,10000) s(i);
                                                                                                                               tdigest                                                                                                                               
---------------------------------------------------------------------------------------------------------------------------------------------------------------------------------------------------------------------------------------------------------------------
 {"flags": 1, "count": 10000, "compression": 10, "centroids": 14, "mean": [0.0001, 0.0004, 0.0013, 0.00405, 0.0135, 0.05375, 0.2351, 0.59225, 0.88255, 0.9768, 0.99275, 0.99775, 0.9997, 1], "count": [1, 5, 13, 42, 147, 658, 2969, 4174, 1632, 253, 66, 34, 5, 1]}
(1 row)

SELECT cast(tdigest(i / 10000.0, 25) as json) from generate_series(1,10000) s(i);
                                                                                                                                                                                     tdigest                                                                                                                                                                                      
----------------------------------------------------------------------------------------------------------------------------------------------------------------------------------------------------------------------------------------------------------------------------------------------------------------------------------------------------------------------------------
 {"flags": 1, "count": 10000, "compression": 25, "centroids": 23, "mean": [0.0001, 0.00025, 0.00055, 0.0012, 0.00265, 0.00575, 0.0115, 0.0232, 0.0472, 0.086, 0.16815, 0.344, 0.5525, 0.7565, 0.902, 0.95005, 0.9761, 0.9919, 0.99755, 0.99925, 0.99975, 0.9999, 1], "count": [1, 2, 4, 9, 20, 42, 73, 161, 319, 457, 1186, 2331, 1839, 2241, 669, 292, 229, 87, 26, 8, 2, 1, 1]}
(1 row)

SELECT cast(tdigest(i / 10000.0, 100) as json) from generate_series(1,10000) s(i);
                                                                                                                                                                                                                                                                                                                                                                         tdigest                                                                                                                                                                                                                                                                                                                                                                          
----------------------------------------------------------------------------------------------------------------------------------------------------------------------------------------------------------------------------------------------------------------------------------------------------------------------------------------------------------------------------------------------------------------------------------------------------------------------------------------------------------------------------------------------------------------------------------------------------------------------------------------------------------------------------------------------------------------------------------------------------------
 {"flags": 1, "count": 10000, "compression": 100, "centroids": 52, "mean": [0.0001, 0.0002, 0.0003, 0.0004, 0.00055, 0.00075, 0.001, 0.00135, 0.0018, 0.00245, 0.0034, 0.0047, 0.0065, 0.009, 0.01245, 0.0171, 0.02315, 0.03075, 0.03985, 0.0501, 0.06455, 0.0842, 0.10595, 0.13495, 0.18065, 0.24805, 0.33, 0.42235, 0.5092, 0.60375, 0.6915, 0.75715, 0.8183, 0.8637, 0.8966, 0.91835, 0.93985, 0.96045, 0.9739, 0.98335, 0.9894, 0.99325, 0.9957, 0.99725, 0.99825, 0.9989, 0.9993, 0.99955, 0.9997, 0.9998, 0.9999, 1], "count": [1, 1, 1, 1, 2, 2, 3, 4, 5, 8, 11, 15, 21, 29, 40, 53, 68, 84, 98, 107, 182, 211, 224, 356, 558, 790, 849, 998, 739, 1152, 603, 710, 513, 395, 263, 172, 258, 154, 115, 74, 47, 30, 19, 12, 8, 5, 3, 2, 1, 1, 1, 1]}
(1 row)

-- test casting to double precision array
SELECT cast(tdigest(i / 10000.0, 10) as double precision[]) from generate_series(1,10000) s(i);
                                                                                                                                       tdigest                                                                                                                                        
--------------------------------------------------------------------------------------------------------------------------------------------------------------------------------------------------------------------------------------------------------------------------------------
 {1,10000,10,14,0.0001,1,0.0003999999999999999,5,0.0013000000000000002,13,0.004050000000000001,42,0.013500000000000002,147,0.05374999999999999,658,0.23510000000000003,2969,0.5922499999999999,4174,0.8825499999999998,1632,0.9768,253,0.99275,66,0.9977499999999999,34,0.9997,5,1,1}
(1 row)

SELECT cast(tdigest(i / 10000.0, 25) as double precision[]) from generate_series(1,10000) s(i);
                                                                                                                                                                                                  tdigest                                                                                                                                                                                                  
-----------------------------------------------------------------------------------------------------------------------------------------------------------------------------------------------------------------------------------------------------------------------------------------------------------------------------------------------------------------------------------------------------------
 {1,10000,25,23,0.0001,1,0.00025,2,0.00055,4,0.0012000000000000001,9,0.0026500000000000004,20,0.00575,42,0.011499999999999998,73,0.0232,161,0.0472,319,0.08599999999999997,457,0.16814999999999997,1186,0.34400000000000003,2331,0.5525,1839,0.7564999999999997,2241,0.902,669,0.9500500000000001,292,0.9761000000000001,229,0.9919000000000001,87,0.9975500000000002,26,0.99925,8,0.99975,2,0.9999,1,1,1}
(1 row)

SELECT cast(tdigest(i / 10000.0, 100) as double precision[]) from generate_series(1,10000) s(i);
                                                                                                                                                                                                                                                                                                                                                                                                                                                                                                  tdigest                                                                                                                                                                                                                                                                                                                                                                                                                                                                                                   
------------------------------------------------------------------------------------------------------------------------------------------------------------------------------------------------------------------------------------------------------------------------------------------------------------------------------------------------------------------------------------------------------------------------------------------------------------------------------------------------------------------------------------------------------------------------------------------------------------------------------------------------------------------------------------------------------------------------------------------------------------------------------------------------------------------------------------------------------------------------------------------------------------------------------------------------------------------------------------------------------------
 {1,10000,100,52,0.0001,1,0.0002,1,0.0003,1,0.0004,1,0.0005499999999999999,2,0.00075,2,0.001,3,0.0013499999999999999,4,0.0018000000000000002,5,0.00245,8,0.0034000000000000002,11,0.004700000000000001,15,0.006500000000000001,21,0.009000000000000003,29,0.01245,40,0.017099999999999997,53,0.023149999999999997,68,0.030750000000000013,84,0.039850000000000003,98,0.05010000000000001,107,0.06455,182,0.08420000000000001,211,0.10595000000000002,224,0.13494999999999993,356,0.18064999999999998,558,0.24805000000000005,790,0.33000000000000007,849,0.42235000000000006,998,0.5091999999999999,739,0.6037500000000001,1152,0.6914999999999997,603,0.7571499999999999,710,0.8183,513,0.8636999999999998,395,0.8966000000000001,263,0.9183500000000001,172,0.9398499999999999,258,0.96045,154,0.9739,115,0.9833499999999997,74,0.9894000000000001,47,0.99325,30,0.9957000000000001,19,0.9972500000000002,12,0.9982500000000001,8,0.9989000000000001,5,0.9993,3,0.99955,2,0.9997,1,0.9998,1,0.9999,1,1,1}
(1 row)

-- <value,count> API
select tdigest_percentile(value, count, 100, 0.95)
from (values
  (47325940488,1),
  (15457695432,2),
  (6889790700,3),
  (4188763788,4),
  (2882932224,5),
  (2114815860,6),
  (1615194324,7),
  (2342114568,9),
  (1626471924,11),
  (1660755408,14),
  (1143728292,17),
  (1082582424,21),
  (911488284,26),
  (728863908,32),
  (654898692,40),
  (530198076,50),
  (417883440,62),
  (341452344,77),
  (274579584,95),
  (231921120,118),
  (184091820,146),
  (152469828,181),
  (125634972,224),
  (107059704,278),
  (88746120,345),
  (73135668,428),
  (61035756,531),
  (50683320,658),
  (42331824,816),
  (35234400,1012),
  (29341356,1255),
  (24290928,1556),
  (20284668,1929),
  (17215908,2391),
  (14737488,2964),
  (12692772,3674),
  (11220732,4555),
  (9787584,5647),
  (8148420,7000),
  (6918612,8678),
  (6015000,10758),
  (5480316,13336),
  (5443356,16532),
  (4535616,20494),
  (3962316,25406),
  (3914484,31495),
  (3828108,39043),
  (3583536,48400),
  (4104120,60000),
  (166024740,2147483647)) foo (count, value);
 tdigest_percentile 
--------------------
 30.358618321611857
(1 row)

----------------------------------------------
-- nice data set with random data (uniform) --
----------------------------------------------
-- 10 centroids (tiny)
WITH
 data AS (SELECT prng(10000) x, prng(10000, 29823218) cnt),
 data_expanded AS (SELECT x FROM (SELECT x, generate_series(1, (10 + 100 * cnt)::int) FROM data) foo ORDER BY random())
SELECT
    p,
    abs(a - b) < 0.1, -- arbitrary threshold of 10%
    (CASE WHEN abs(a - b) < 0.1 THEN NULL ELSE (a - b) END) AS err
FROM (
    SELECT
        unnest(ARRAY[0.01, 0.05, 0.1, 0.9, 0.95, 0.99]) AS p,
        unnest(a) AS a,
        unnest(b) AS b
    FROM
       (SELECT percentile_cont(ARRAY[0.01, 0.05, 0.1, 0.9, 0.95, 0.99]) WITHIN GROUP (ORDER BY x) a FROM data_expanded) foo,
       (SELECT tdigest_percentile(x, (10 + 100 * cnt)::int, 10, ARRAY[0.01, 0.05, 0.1, 0.9, 0.95, 0.99]) b FROM data) bar
) baz;
  p   | ?column? | err 
------+----------+-----
 0.01 | t        |    
 0.05 | t        |    
  0.1 | t        |    
  0.9 | t        |    
 0.95 | t        |    
 0.99 | t        |    
(6 rows)

-- 100 centroids (okay-ish)
WITH
 data AS (SELECT prng(10000) x, prng(10000, 29823218) cnt),
 data_expanded AS (SELECT x FROM (SELECT x, generate_series(1, (10 + 100 * cnt)::int) FROM data) foo ORDER BY random())
SELECT
    p,
    abs(a - b) < 0.01, -- arbitrary threshold of 1%
    (CASE WHEN abs(a - b) < 0.1 THEN NULL ELSE (a - b) END) AS err
FROM (
    SELECT
        unnest(ARRAY[0.01, 0.05, 0.1, 0.9, 0.95, 0.99]) AS p,
        unnest(a) AS a,
        unnest(b) AS b
    FROM
       (SELECT percentile_cont(ARRAY[0.01, 0.05, 0.1, 0.9, 0.95, 0.99]) WITHIN GROUP (ORDER BY x) a FROM data_expanded) foo,
       (SELECT tdigest_percentile(x, (10 + 100 * cnt)::int, 100, ARRAY[0.01, 0.05, 0.1, 0.9, 0.95, 0.99]) b FROM data) bar
) baz;
  p   | ?column? | err 
------+----------+-----
 0.01 | t        |    
 0.05 | t        |    
  0.1 | t        |    
  0.9 | t        |    
 0.95 | t        |    
 0.99 | t        |    
(6 rows)

-- 1000 centroids (very accurate)
WITH
 data AS (SELECT prng(10000) x, prng(10000, 29823218) cnt),
 data_expanded AS (SELECT x FROM (SELECT x, generate_series(1, (10 + 100 * cnt)::int) FROM data) foo ORDER BY random())
SELECT
    p,
    abs(a - b) < 0.001, -- arbitrary threshold of 0.1%
    (CASE WHEN abs(a - b) < 0.1 THEN NULL ELSE (a - b) END) AS err
FROM (
    SELECT
        unnest(ARRAY[0.01, 0.05, 0.1, 0.9, 0.95, 0.99]) AS p,
        unnest(a) AS a,
        unnest(b) AS b
    FROM
       (SELECT percentile_cont(ARRAY[0.01, 0.05, 0.1, 0.9, 0.95, 0.99]) WITHIN GROUP (ORDER BY x) a FROM data_expanded) foo,
       (SELECT tdigest_percentile(x, (10 + 100 * cnt)::int, 1000, ARRAY[0.01, 0.05, 0.1, 0.9, 0.95, 0.99]) b FROM data) bar
) baz;
  p   | ?column? | err 
------+----------+-----
 0.01 | t        |    
 0.05 | t        |    
  0.1 | t        |    
  0.9 | t        |    
 0.95 | t        |    
 0.99 | t        |    
(6 rows)

-- test incremental API (adding values one by one)
CREATE TABLE t (d tdigest);
INSERT INTO t VALUES (NULL);
-- check this produces the same result building the tdigest at once, but we
-- need to be careful about feeding the data in the same order, and we must
-- not compactify the t-digest after each increment
DO LANGUAGE plpgsql $$
DECLARE
  r RECORD;
BEGIN
    FOR r IN (SELECT i FROM generate_series(1,1000) s(i) ORDER BY md5(i::text)) LOOP
        UPDATE t SET d = tdigest_add(d, r.i, 100, false);
    END LOOP;
END$$;
-- compare the results, but do force a compaction of the incremental result
WITH x AS (SELECT i FROM generate_series(1,1000) s(i) ORDER BY md5(i::text))
SELECT (SELECT tdigest(d)::text FROM t) = (SELECT tdigest(x.i, 100)::text FROM x) AS match;
 match 
-------
 t
(1 row)

-- now try the same thing with bulk incremental update (using arrays)
TRUNCATE t;
INSERT INTO t VALUES (NULL);
DO LANGUAGE plpgsql $$
DECLARE
  r RECORD;
BEGIN
    FOR r IN (SELECT a, array_agg(i::double precision) AS v FROM (SELECT mod(i,5) AS a, i FROM generate_series(1,1000) s(i) ORDER BY mod(i,5), md5(i::text)) foo GROUP BY a ORDER BY a) LOOP
        UPDATE t SET d = tdigest_add(d, r.v, 100, false);
    END LOOP;
END$$;
-- compare the results, but do force a compaction of the incremental result
WITH x AS (SELECT mod(i,5) AS a, i::double precision AS d FROM generate_series(1,1000) s(i) ORDER BY mod(i,5), i)
SELECT (SELECT tdigest(d)::text FROM t) = (SELECT tdigest(x.d, 100)::text FROM x);
 ?column? 
----------
 t
(1 row)

-- now try the same thing with bulk incremental update (using t-digests)
TRUNCATE t;
INSERT INTO t VALUES (NULL);
DO LANGUAGE plpgsql $$
DECLARE
  r RECORD;
BEGIN
    FOR r IN (SELECT a, tdigest(i,100) AS d FROM (SELECT mod(i,5) AS a, i FROM generate_series(1,1000) s(i) ORDER BY mod(i,5), md5(i::text)) foo GROUP BY a ORDER BY a) LOOP
        UPDATE t SET d = tdigest_union(d, r.d, false);
    END LOOP;
END$$;
-- compare the results, but do force a compaction of the incremental result
WITH x AS (SELECT a, tdigest(i,100) AS d FROM (SELECT mod(i,5) AS a, i FROM generate_series(1,1000) s(i) ORDER BY mod(i,5), md5(i::text)) foo GROUP BY a ORDER BY a)
SELECT (SELECT tdigest(d)::text FROM t) = (SELECT tdigest(x.d)::text FROM x);
 ?column? 
----------
 t
(1 row)

-- test parallel query
DROP TABLE t;
CREATE TABLE t (v double precision, c int, d int);
INSERT INTO t SELECT 1000 * random(), 1 + mod(i,7), mod(i,113) FROM generate_series(1,1000000) s(i);
ANALYZE t;
CREATE TABLE t2 (d tdigest);
INSERT INTO t2 SELECT tdigest(v, 100) FROM t GROUP BY d;
ANALYZE t2;
SET parallel_setup_cost = 0;
SET parallel_tuple_cost = 0;
SET min_parallel_table_scan_size = '1kB';
-- individual values
EXPLAIN (COSTS OFF)
WITH x AS (SELECT percentile_disc(0.95) WITHIN GROUP (ORDER BY v) AS p FROM t)
SELECT
  0.95,
  abs(a - b) / 1000 < 0.01
FROM (
  SELECT
    (SELECT p FROM x) AS a,
    tdigest_percentile(v, 100, 0.95) AS b
  FROM t) foo;
                      QUERY PLAN                      
------------------------------------------------------
 Subquery Scan on foo
   ->  Finalize Aggregate
         InitPlan 1 (returns $1)
           ->  Aggregate
                 ->  Gather
                       Workers Planned: 2
                       ->  Parallel Seq Scan on t t_1
         ->  Gather
               Workers Planned: 2
               ->  Partial Aggregate
                     ->  Parallel Seq Scan on t
(11 rows)

WITH x AS (SELECT percentile_disc(0.95) WITHIN GROUP (ORDER BY v) AS p FROM t)
SELECT
  0.95,
  abs(a - b) / 1000 < 0.01
FROM (
  SELECT
    (SELECT p FROM x) AS a,
    tdigest_percentile(v, 100, 0.95) AS b
  FROM t) foo;
 ?column? | ?column? 
----------+----------
     0.95 | t
(1 row)

EXPLAIN (COSTS OFF)
SELECT
  950,
  abs(a - b) < 0.01
FROM (
  SELECT
    0.95 AS a,
    tdigest_percentile_of(v, 100, 950) AS b
  FROM t) foo;
                   QUERY PLAN                   
------------------------------------------------
 Subquery Scan on foo
   ->  Finalize Aggregate
         ->  Gather
               Workers Planned: 2
               ->  Partial Aggregate
                     ->  Parallel Seq Scan on t
(6 rows)

SELECT
  950,
  abs(a - b) < 0.01
FROM (
  SELECT
    0.95 AS a,
    tdigest_percentile_of(v, 100, 950) AS b
  FROM t) foo;
 ?column? | ?column? 
----------+----------
      950 | t
(1 row)

EXPLAIN (COSTS OFF)
WITH x AS (SELECT percentile_disc(0.95) WITHIN GROUP (ORDER BY v) AS p FROM t)
SELECT
  0.95,
  abs(a - b) / 1000 < 0.01
FROM (
  SELECT
    (SELECT p FROM x) AS a,
    tdigest_percentile(d, 0.95) AS b
  FROM t2) foo;
                    QUERY PLAN                    
--------------------------------------------------
 Subquery Scan on foo
   ->  Finalize Aggregate
         InitPlan 1 (returns $1)
           ->  Aggregate
                 ->  Gather
                       Workers Planned: 2
                       ->  Parallel Seq Scan on t
         ->  Gather
               Workers Planned: 2
               ->  Partial Aggregate
                     ->  Parallel Seq Scan on t2
(11 rows)

WITH x AS (SELECT percentile_disc(0.95) WITHIN GROUP (ORDER BY v) AS p FROM t)
SELECT
  0.95,
  abs(a - b) / 1000 < 0.01
FROM (
  SELECT
    (SELECT p FROM x) AS a,
    tdigest_percentile(d, 0.95) AS b
  FROM t2) foo;
 ?column? | ?column? 
----------+----------
     0.95 | t
(1 row)

EXPLAIN (COSTS OFF)
SELECT
  950,
  abs(a - b) < 0.01
FROM (
  SELECT
    0.95 AS a,
    tdigest_percentile_of(d, 950) AS b
  FROM t2) foo;
                   QUERY PLAN                    
-------------------------------------------------
 Subquery Scan on foo
   ->  Finalize Aggregate
         ->  Gather
               Workers Planned: 2
               ->  Partial Aggregate
                     ->  Parallel Seq Scan on t2
(6 rows)

SELECT
  950,
  abs(a - b) < 0.01
FROM (
  SELECT
    0.95 AS a,
    tdigest_percentile_of(d, 950) AS b
  FROM t2) foo;
 ?column? | ?column? 
----------+----------
      950 | t
(1 row)

-- array of percentiles / values
EXPLAIN (COSTS OFF)
WITH x AS (SELECT percentile_disc(ARRAY[0.0, 0.95, 0.99, 1.0]) WITHIN GROUP (ORDER BY v) AS p FROM t)
SELECT
  p,
  abs(a - b) / 1000 < 0.01
FROM (
  SELECT
    unnest(ARRAY[0.0, 0.95, 0.99, 1.0]) p,
    unnest((SELECT p FROM x)) AS a,
    unnest(tdigest_percentile(v, 100, ARRAY[0.0, 0.95, 0.99, 1.0])) AS b
  FROM t) foo;
                      QUERY PLAN                      
------------------------------------------------------
 Subquery Scan on foo
   ->  ProjectSet
         InitPlan 1 (returns $1)
           ->  Aggregate
                 ->  Gather
                       Workers Planned: 2
                       ->  Parallel Seq Scan on t t_1
         ->  Finalize Aggregate
               ->  Gather
                     Workers Planned: 2
                     ->  Partial Aggregate
                           ->  Parallel Seq Scan on t
(12 rows)

WITH x AS (SELECT percentile_disc(ARRAY[0.0, 0.95, 0.99, 1.0]) WITHIN GROUP (ORDER BY v) AS p FROM t)
SELECT
  p,
  abs(a - b) / 1000 < 0.01
FROM (
  SELECT
    unnest(ARRAY[0.0, 0.95, 0.99, 1.0]) p,
    unnest((SELECT p FROM x)) AS a,
    unnest(tdigest_percentile(v, 100, ARRAY[0.0, 0.95, 0.99, 1.0])) AS b
  FROM t) foo;
  p   | ?column? 
------+----------
  0.0 | t
 0.95 | t
 0.99 | t
  1.0 | t
(4 rows)

EXPLAIN (COSTS OFF)
WITH x AS (SELECT array_agg((SELECT percent_rank(f) WITHIN GROUP (ORDER BY v) FROM t)) AS p FROM unnest(ARRAY[950, 990]) f)
SELECT
  p,
  abs(a - b) < 0.01
FROM (
  SELECT
    unnest(ARRAY[950, 990]) AS p,
    unnest((SELECT p FROM x)) AS a,
    unnest(tdigest_percentile_of(v, 100, ARRAY[950, 990])) AS b
  FROM t) foo;
                          QUERY PLAN                          
--------------------------------------------------------------
 Subquery Scan on foo
   ->  ProjectSet
         InitPlan 2 (returns $2)
           ->  Aggregate
                 ->  Function Scan on unnest f
                 SubPlan 1
                   ->  Aggregate
                         ->  Gather
                               Workers Planned: 2
                               ->  Parallel Seq Scan on t t_1
         ->  Finalize Aggregate
               ->  Gather
                     Workers Planned: 2
                     ->  Partial Aggregate
                           ->  Parallel Seq Scan on t
(15 rows)

WITH x AS (SELECT array_agg((SELECT percent_rank(f) WITHIN GROUP (ORDER BY v) FROM t)) AS p FROM unnest(ARRAY[950, 990]) f)
SELECT
  p,
  abs(a - b) < 0.01
FROM (
  SELECT
    unnest(ARRAY[950, 990]) AS p,
    unnest((SELECT p FROM x)) AS a,
    unnest(tdigest_percentile_of(v, 100, ARRAY[950, 990])) AS b
  FROM t) foo;
  p  | ?column? 
-----+----------
 950 | t
 990 | t
(2 rows)

EXPLAIN (COSTS OFF)
WITH x AS (SELECT percentile_disc(ARRAY[0.0, 0.95, 0.99, 1.0]) WITHIN GROUP (ORDER BY v) AS p FROM t)
SELECT
  p,
  abs(a - b) / 1000 < 0.01
FROM (
  SELECT
    unnest(ARRAY[0.0, 0.95, 0.99, 1.0]) p,
    unnest((SELECT p FROM x)) AS a,
    unnest(tdigest_percentile(d, ARRAY[0.0, 0.95, 0.99, 1.0])) AS b
  FROM t2) foo;
                      QUERY PLAN                       
-------------------------------------------------------
 Subquery Scan on foo
   ->  ProjectSet
         InitPlan 1 (returns $1)
           ->  Aggregate
                 ->  Gather
                       Workers Planned: 2
                       ->  Parallel Seq Scan on t
         ->  Finalize Aggregate
               ->  Gather
                     Workers Planned: 2
                     ->  Partial Aggregate
                           ->  Parallel Seq Scan on t2
(12 rows)

WITH x AS (SELECT percentile_disc(ARRAY[0.0, 0.95, 0.99, 1.0]) WITHIN GROUP (ORDER BY v) AS p FROM t)
SELECT
  p,
  abs(a - b) / 1000 < 0.01
FROM (
  SELECT
    unnest(ARRAY[0.0, 0.95, 0.99, 1.0]) p,
    unnest((SELECT p FROM x)) AS a,
    unnest(tdigest_percentile(d, ARRAY[0.0, 0.95, 0.99, 1.0])) AS b
  FROM t2) foo;
  p   | ?column? 
------+----------
  0.0 | t
 0.95 | t
 0.99 | t
  1.0 | t
(4 rows)

EXPLAIN (COSTS OFF)
WITH x AS (SELECT array_agg((SELECT percent_rank(f) WITHIN GROUP (ORDER BY v) FROM t)) AS p FROM unnest(ARRAY[950, 990]) f)
SELECT
  p,
  abs(a - b) < 0.01
FROM (
  SELECT
    unnest(ARRAY[950, 990]) AS p,
    unnest((SELECT p FROM x)) AS a,
    unnest(tdigest_percentile_of(d, ARRAY[950, 990])) AS b
  FROM t2) foo;
                        QUERY PLAN                        
----------------------------------------------------------
 Subquery Scan on foo
   ->  ProjectSet
         InitPlan 2 (returns $2)
           ->  Aggregate
                 ->  Function Scan on unnest f
                 SubPlan 1
                   ->  Aggregate
                         ->  Gather
                               Workers Planned: 2
                               ->  Parallel Seq Scan on t
         ->  Finalize Aggregate
               ->  Gather
                     Workers Planned: 2
                     ->  Partial Aggregate
                           ->  Parallel Seq Scan on t2
(15 rows)

WITH x AS (SELECT array_agg((SELECT percent_rank(f) WITHIN GROUP (ORDER BY v) FROM t)) AS p FROM unnest(ARRAY[950, 990]) f)
SELECT
  p,
  abs(a - b) < 0.01
FROM (
  SELECT
    unnest(ARRAY[950, 990]) AS p,
    unnest((SELECT p FROM x)) AS a,
    unnest(tdigest_percentile_of(d, ARRAY[950, 990])) AS b
  FROM t2) foo;
  p  | ?column? 
-----+----------
 950 | t
 990 | t
(2 rows)

-- <value,count> API
EXPLAIN (COSTS OFF)
WITH
  d AS (SELECT t.* FROM t, LATERAL generate_series(1,t.c)),
  x AS (SELECT percentile_disc(0.95) WITHIN GROUP (ORDER BY v) AS p FROM d)
SELECT
  0.95,
  abs(a - b) / 1000 < 0.01
FROM (
  SELECT
    (SELECT p FROM x) AS a,
    tdigest_percentile(v, c, 100, 0.95) AS b
  FROM t) foo;
                            QUERY PLAN                            
------------------------------------------------------------------
 Subquery Scan on foo
   ->  Finalize Aggregate
         InitPlan 1 (returns $2)
           ->  Aggregate
                 ->  Gather
                       Workers Planned: 2
                       ->  Nested Loop
                             ->  Parallel Seq Scan on t t_1
                             ->  Function Scan on generate_series
         ->  Gather
               Workers Planned: 2
               ->  Partial Aggregate
                     ->  Parallel Seq Scan on t
(13 rows)

WITH
  d AS (SELECT t.* FROM t, LATERAL generate_series(1,t.c)),
  x AS (SELECT percentile_disc(0.95) WITHIN GROUP (ORDER BY v) AS p FROM d)
SELECT
  0.95,
  abs(a - b) / 1000 < 0.01
FROM (
  SELECT
    (SELECT p FROM x) AS a,
    tdigest_percentile(v, c, 100, 0.95) AS b
  FROM t) foo;
 ?column? | ?column? 
----------+----------
     0.95 | t
(1 row)

EXPLAIN (COSTS OFF)
WITH
  d AS (SELECT t.* FROM t, LATERAL generate_series(1,t.c)),
  x AS (SELECT percent_rank(950) WITHIN GROUP (ORDER BY v) AS p FROM d)
SELECT
  950,
  abs(a - b) < 0.01
FROM (
  SELECT
    (SELECT p FROM x) AS a,
    tdigest_percentile_of(v, c, 100, 950) AS b
  FROM t) foo;
                            QUERY PLAN                            
------------------------------------------------------------------
 Subquery Scan on foo
   ->  Finalize Aggregate
         InitPlan 1 (returns $2)
           ->  Aggregate
                 ->  Gather
                       Workers Planned: 2
                       ->  Nested Loop
                             ->  Parallel Seq Scan on t t_1
                             ->  Function Scan on generate_series
         ->  Gather
               Workers Planned: 2
               ->  Partial Aggregate
                     ->  Parallel Seq Scan on t
(13 rows)

WITH
  d AS (SELECT t.* FROM t, LATERAL generate_series(1,t.c)),
  x AS (SELECT percent_rank(950) WITHIN GROUP (ORDER BY v) AS p FROM d)
SELECT
  950,
  abs(a - b) < 0.01
FROM (
  SELECT
    (SELECT p FROM x) AS a,
    tdigest_percentile_of(v, c, 100, 950) AS b
  FROM t) foo;
 ?column? | ?column? 
----------+----------
      950 | t
(1 row)

-- array of percentiles / values
EXPLAIN (COSTS OFF)
WITH
  d AS (SELECT t.* FROM t, LATERAL generate_series(1,t.c)),
  x AS (SELECT percentile_disc(ARRAY[0.0, 0.95, 0.99, 1.0]) WITHIN GROUP (ORDER BY v) AS p FROM d)
SELECT
  p,
  abs(a - b) / 1000 < 0.01
FROM (
  SELECT
    unnest(ARRAY[0.0, 0.95, 0.99, 1.0]) p,
    unnest((SELECT p FROM x)) AS a,
    unnest(tdigest_percentile(v, c, 100, ARRAY[0.0, 0.95, 0.99, 1.0])) AS b
  FROM t) foo;
                            QUERY PLAN                            
------------------------------------------------------------------
 Subquery Scan on foo
   ->  ProjectSet
         InitPlan 1 (returns $2)
           ->  Aggregate
                 ->  Gather
                       Workers Planned: 2
                       ->  Nested Loop
                             ->  Parallel Seq Scan on t t_1
                             ->  Function Scan on generate_series
         ->  Finalize Aggregate
               ->  Gather
                     Workers Planned: 2
                     ->  Partial Aggregate
                           ->  Parallel Seq Scan on t
(14 rows)

WITH
  d AS (SELECT t.* FROM t, LATERAL generate_series(1,t.c)),
  x AS (SELECT percentile_disc(ARRAY[0.0, 0.95, 0.99, 1.0]) WITHIN GROUP (ORDER BY v) AS p FROM d)
SELECT
  p,
  abs(a - b) / 1000 < 0.01
FROM (
  SELECT
    unnest(ARRAY[0.0, 0.95, 0.99, 1.0]) p,
    unnest((SELECT p FROM x)) AS a,
    unnest(tdigest_percentile(v, c, 100, ARRAY[0.0, 0.95, 0.99, 1.0])) AS b
  FROM t) foo;
  p   | ?column? 
------+----------
  0.0 | t
 0.95 | t
 0.99 | t
  1.0 | t
(4 rows)

EXPLAIN (COSTS OFF)
WITH
  d AS (SELECT t.* FROM t, LATERAL generate_series(1,t.c)),
  x AS (SELECT array_agg((SELECT percent_rank(f) WITHIN GROUP (ORDER BY v) AS p FROM d)) p FROM unnest(ARRAY[950, 990]) f)
SELECT
  p,
  abs(a - b) < 0.01
FROM (
  SELECT
    unnest(ARRAY[950, 990]) AS p,
    unnest((select x.p from x)) AS a,
    unnest(tdigest_percentile_of(v, c, 100, ARRAY[950, 990])) AS b
  FROM t) foo;
                                QUERY PLAN                                
--------------------------------------------------------------------------
 Subquery Scan on foo
   ->  ProjectSet
         InitPlan 2 (returns $3)
           ->  Aggregate
                 ->  Function Scan on unnest f
                 SubPlan 1
                   ->  Aggregate
                         ->  Gather
                               Workers Planned: 2
                               ->  Nested Loop
                                     ->  Parallel Seq Scan on t t_1
                                     ->  Function Scan on generate_series
         ->  Finalize Aggregate
               ->  Gather
                     Workers Planned: 2
                     ->  Partial Aggregate
                           ->  Parallel Seq Scan on t
(17 rows)

WITH
  d AS (SELECT t.* FROM t, LATERAL generate_series(1,t.c)),
  x AS (SELECT array_agg((SELECT percent_rank(f) WITHIN GROUP (ORDER BY v) AS p FROM d)) p FROM unnest(ARRAY[950, 990]) f)
SELECT
  p,
  abs(a - b) < 0.01
FROM (
  SELECT
    unnest(ARRAY[950, 990]) AS p,
    unnest((select x.p from x)) AS a,
    unnest(tdigest_percentile_of(v, c, 100, ARRAY[950, 990])) AS b
  FROM t) foo;
  p  | ?column? 
-----+----------
 950 | t
 990 | t
(2 rows)

